author;year;database;citation_ori;citation;BibTeX_reference;Name;mail;Authors;Collaborators;DOI;url;Title;Publisher;Type;Journal;More info
Plue;2010;RU;Plue 2010;Plue 2010;;;J. Plue; B. Van Gils C. Peppler-Lisbach A. De Schrijver K. Verheyen M. Hermy;B. Van Gils , C. Peppler-Lisbach , A. De Schrijver , K. Verheyen , M. Hermy ;https://doi.org/10.1016/j.ppees.2010.03.001;https://www.sciencedirect.com/science/article/abs/pii/S1433831910000223;Seed- bank convergence under different tree species during forest development;sciencedirect;Journal Article;Perspect. Plant Ecol. Evol. Syst.;12 211–218 
Williams;2000;RU;Williams 2000;Williams 2000;;;Charles E. Williams; W. J. Moriarity . Symp. Sustain. Manag;William J. Moriarity;https://www.researchgate.net/publication/237139010_Composition_and_Structure_of_Hemlock-Dominated_Riparian_Forests_of_the_Northern_Allegheny_Plateau_A_Baseline_Assessment;https://www.researchgate.net/publication/237139010_Composition_and_Structure_of_Hemlock-Dominated_Riparian_Forests_of_the_Northern_Allegheny_Plateau_A_Baseline_Assessment;Composition and structure of hemlock-dominated riparian forests of thenorthern Allegheny Plateau: A baseline assessment;ResearchGate;Journal Article;Hemlock Ecosyst. EasternNorth Am. Proc;267 216–224 
Zhu;2009;RU;Zhu 2009;Zhu 2009;;;Wanze Zhu; S. Cheng X. Cai F. He J. Wang;Song Cheng, Xiaohu Cai, Fei He & Jinxi Wang ;https://doi.org/10.1007/s11284-008-0508-y;https://link.springer.com/article/10.1007/s11284-008-0508-y;Changes in plant species diversity along a chronosequence of vegetation restoration in the humid evergreen broad-leaved forest in the Rainy Zone of West China;wiley;Journal Article;Plant Ecol. Divers;24 315–325 
Addo-Fordjour;2019;RU;Addo-Fordjour 2019;Addo-Fordjour 2019;;;Patrick Addo-Fordjour; B. Ofosu-Bamfo F. Kwofie N. Akyea-Bobi F. A. Rahman E. Amoah;Bismark Ofosu-Bamfo,Francis Kwofie,Nukunu Akyea-Bobi,Fidaus A. Rahman &Emmanuel Amoah;https://doi.org/10.1080/17550874.2019.1675095;https://www.tandfonline.com/doi/full/10.1080/17550874.2019.1675095;Changes in liana community structure and functional traits along a chronosequence ofselective logging in a moist semi-deciduous forest in Ghana;tandfonline;Journal Article;Plant Ecology & Diversity  Volume 13, 2020 - Issue 1;Pages 75-84 | Received 07 Apr 2018, Accepted 27 Sep 2019, Published online: 13 Oct 2019
Lopez-Jimenez;2019;RU;Lopez-Jimenez 2019;Lopez-Jimenez 2019;;Leonardo Noriel López-Jiménez;https://www.researchgate.net/profile/Leonardo-Noriel-Lopez-Jimenez;Rafael Durán-García, Juan Manuel Dupuy-Rada;Rafael Durán-García, Juan Manuel Dupuy-Rada;https://doi.org/10.21829/myb.2019.2511587;https://myb.ojs.inecol.mx/index.php/myb/article/view/e2511587;;;;;
Webb and Sah;2003;HU;Webb and Sah 2003;Webb and Sah 2003;;Edward L Webb;ewebb@ait.ac.th; Gaertn.f.;Ram N Sah;https://doi.org/10.1016/S0378-1127(02)00272-4;https://www.sciencedirect.com/science/article/abs/pii/S0378112702002724;Structure and diversity of natural and managed salShorea robusta;sciencedirect;Journal Article;Forest Ecology and Management;Volume 176, Issues 1–3, 17 March 2003, Pages 337-353
Upadhaya;2015;HU;Upadhaya et al. 2015;Upadhaya et al. 2015;;Krishna Upadhaya;; S. K. Barik;Namita ThapaSaroj, Barik Saroj Barik, Kanta Barik;https://www.researchgate.net/publication/267338564_Tree_diversity_and_biomass_of_tropical_forests_under_two_management_regimes_in_Garo_hills_of_north-eastern_India;https://www.researchgate.net/publication/267338564_Tree_diversity_and_biomass_of_tropical_forests_under_two_management_regimes_in_Garo_hills_of_north-eastern_India;Tree diversity and biomass of tropicalforests under two management regimes in Garo hills of north-eastern India;researchgate;Journal Article;Tropical Ecology;56(2):257-268
