author;year;database;citation_ori;citation;BibTeX_reference;Name;mail;Authors;Collaborators;DOI;url;Title;Publisher;Type;Journal;More info
Baeten;2010;PR;Baeten et al. 2010;Baeten et al. 2010;BaetenEtAl2010;Lander Baeten;Lander Baeten;Baeten, L.;Darline Velghe, Margot Vanhellemont, Pieter De Frenne, Martin Hermy, Kris Verheyen;https://doi.org/10.1111/j.1526-100x.2009.00627.x;https://onlinelibrary.wiley.com/doi/10.1111/j.1526-100X.2009.00627.x;Early trajectories of spontaneous vegetation recovery after intensive agricultural land use;Wiley;Journal Article;Restoration Ecology;
Baeten;2010;PR;Baeten et al. 2010a;Baeten et al. 2010a;BaetenEtAl2010a;Lander Baeten;lander.baeten@ugent.be;Baeten, Lander;Martin Hermy, Sander Van Daele, Kris Verheyen;https://doi.org/10.1111/j.1365-2745.2010.01711.x;https://besjournals.onlinelibrary.wiley.com/doi/10.1111/j.1365-2745.2010.01711.x;Unexpected understorey community development after 30 years in ancient and post-agricultural forests;wiley;Journal Article;Journal of Ecology;
Berry;2010;PR;Berry et al. 2010;Berry et al. 2010;BerryEtAl2010;Nicholas J. Berry;Nicholas J. Berry;Berry, N. J.;Oliver L. Phillips, Simon L. Lewis, Jane K. Hill, David P. Edwards, Noel B. Tawatao, Norhayati Ahmad, David Magintan, Chey V. Khen, M. Maryati, Robert C. Ong & Keith C. Hamer ;https://doi.org/10.1007/s10531-010-9779-z;http://link.springer.com/content/pdf/10.1007/s10531-010-9779-z.pdf;The high value of logged tropical forests: lessons from northern Borneo;Springer Science and Business Media LLC;Journal Article;Biodiversity and Conservation;
Brearley;2011;PR;Brearley 2011;Brearley 2011;Brearley2011;Francis Q. Brearley;Francis Q. Brearley;Brearley, Francis Q.;;https://doi.org/10.1017/s0266467411000149;https://www.cambridge.org/core/services/aop-cambridge-core/content/view/S0266467411000149;Below-ground secondary succession in tropical forests of Borneo;Cambridge University Press (CUP);Journal Article;Journal of Tropical Ecology;
Calvino-Cancela;2012;PR;Calvino-Cancela et al. 2012;Calvino-Cancela et al. 2012;CalvinoCancelaEtAl2012;María Calviño-Cancela;María Calviño-Cancela;Calvino-Cancela, Maria;Margarita Rubido-Bará ,Eddie J.B. van Etten;https://doi.org/10.1016/j.foreco.2012.01.019;https://www.sciencedirect.com/science/article/abs/pii/S0378112712000291;Do eucalypt plantations provide habitat for native forest biodiversity?;Elsevier BV;Journal Article;Forest Ecology and Management;
Carvalho;2010;PR;Carvalho et al. 2010;Carvalho et al. 2010;CarvalhoEtAl2010;Anelena Carvalho;https://www.researchgate.net/profile/Anelena-Carvalho;Calvino-Cancela, Maria;Evandro José Linhares Ferreira, Joanna Marie Tucker Lima;https://doi.org/10.1590/S0044-59672010000400004;https://www.researchgate.net/publication/262502592_Floristic_and_structural_comparisons_among_palm_communities_in_primary_and_secondary_forest_fragments_of_the_Raimundo_Irineu_Serra_Environmental_Protection_Area_-_Rio_Branco_Acre_Brazil;Floristic and structural comparisons among palm communities in primary and secondary forest fragments of the Raimundo Irineu Serra Environmental Protection Area - Rio Branco, Acre, Brazil;scielo;Journal Article;Acta Amazonica;
Castro;2010;PR;Castro et al. 2010;Castro et al. 2010;CastroEtAl2010;Helena Castro;Helena Castro;Castro, Helena;Veiko Lehsten b 1, Sandra Lavorel c, Helena Freitas a;https://doi.org/10.1016/j.agee.2010.02.002;https://www.sciencedirect.com/science/article/abs/pii/S0167880910000368;Functional response traits in relation to land use change in the Montado;Elsevier BV;Journal Article;Agriculture Ecosystems & Environment;
Fredriksson;2007;PR;Fredriksson et al. 2007;Fredriksson et al. 2007;FredrikssonEtAl2007;G. M. Fredriksson;gmfred@indo.net.id;Fredriksson, G. M.;L. S. Danielsen & J. E. Swenson ;https://doi.org/10.1007/978-1-4020-6444-9_16;https://link.springer.com/chapter/10.1007/978-1-4020-6444-9_16;Impacts of El Nino related drought and forest fires on sun bear fruit resources in lowland dipterocarp forest of East Borneo;Springer Science and Business Media LLC;Journal Article;Biodiversity and Conservation;
Hylander and Weibull;2012;PR;Hylander and Weibull 2012;Hylander and Weibull 2012;HylanderAndWeibull2012;Kristoffer Hylander;kristoffer.hylander@botan.su.se;Hylander, K.;Henrik Weibull;https://doi.org/10.1111/j.1365-2664.2012.02218.x;https://besjournals.onlinelibrary.wiley.com/doi/10.1111/j.1365-2664.2012.02218.x;Do time-lagged extinctions and colonizations change the interpretation of buffer strip effectiveness? - a study of riparian bryophytes in the first decade after logging;British Ecological Society;Journal Article;Journal of Applied Ecology;
Katovai;2012;PR;Katovai et al. 2012;Katovai et al. 2012;KatovaiEtAl2012;Eric Katovai ;Eric Katovai ;Katovai, E.;Alana L. Burley, Margaret M. Mayfield;https://doi.org/10.1016/j.biocon.2011.11.008;https://api.elsevier.com/content/article/PII:S0006320711004228?httpAccept=text/xml;Understory plant species and functional diversity in the degraded wet tropical forests of Kolombangara Island, Solomon Islands;Elsevier BV;Journal Article;Biological Conservation;
Letcher and Chazdon;2009;PR;Letcher and Chazdon 2009;Letcher and Chazdon 2009;LetcherAndChazdon2009;Susan G. Letcher;Susan G. Letcher;Letcher, S. G.;Robin L. Chazdon;https://doi.org/10.1111/j.1744-7429.2009.00517.x;https://onlinelibrary.wiley.com/doi/10.1111/j.1744-7429.2009.00517.x;Rapid recovery of biomass, species richness, and species composition in a forest chronosequence in northeastern Costa Rica;Wiley;Journal Article;Biotropica;
Lopez-Quintero;2012;PR;Lopez-Quintero et al. 2012;Lopez-Quintero et al. 2012;LopezQuinteroEtAl2012;Carlos A. López-Quintero;Carlos A. López-Quintero;Lopez-Quintero, Carlos A.;Gerben Straatsma, A. Esperanza Franco-Molano & Teun Boekhout ;https://doi.org/10.1007/s10531-012-0280-8;https://link.springer.com/article/10.1007/s10531-012-0280-8;Macrofungal diversity in Colombian Amazon forests varies with regions and regimes of disturbance;Springer Science and Business Media LLC;Journal Article;Article;
McNamara;2012;PR;McNamara et al. 2012;McNamara et al. 2012;McnamaraEtAl2012;S. McNamara;S. McNamara;McNamara, S.;P.D. Erskine a, D. Lamb a, L. Chantalangsy b, S. Boyle c;https://doi.org/10.1016/j.foreco.2012.06.004;https://www.sciencedirect.com/science/article/abs/pii/S0378112712003246;Primary tree species diversity in secondary fallow forests of Laos;Elsevier BV;Journal Article;Forest Ecology and Management;
Noske;2008;PR;Noske et al. 2008;Noske et al. 2008;NoskeEtAl2008;Nicole M. Nöske;Nicole M. Nöske;Ni¶ske, Nicole M.;Nadine Hilt b, Florian A. Werner c, Gunnar Brehm d, Konrad Fiedler e, Harrie J.M. Sipman a, S. Robbert Gradstein c;https://doi.org/10.1016/j.baae.2007.06.014;https://www.sciencedirect.com/science/article/abs/pii/S1439179107000692;Disturbance effects on diversity of epiphytes and moths in a montane forest in Ecuador;Elsevier BV;Journal Article;Basic and Applied Ecology;
Sheil;2001;PR;Sheil et al. 2002;Sheil et al. 2002;SheilEtAl2002;Douglas Sheil;douglas.sheil@nmbu.no;Douglas Sheil;" Puri, R.K.; Basuki, I.; van Heist, M.; Saefuddin; Rukmiyati; Sardjono, M.A.; Samsoedin, I.; Sidiyasa, K.D.; Chrisandini; Permana, E.; Angi, E.M.; Gatzweiler, F.; Johnson, B.; Wijaya, A.";https://doi.org/10.17528/cifor/001021;https://www.researchgate.net/publication/263785619_Exploring_biological_diversity_environment_and_local_people's_perspectives_in_forest_landscapes_Methods_for_a_multidisciplinary_landscape_assessment;Exploring biological diversity, environment and local people's perspectives in forest landscapes: methods for a multidisciplinary landscape assessment;Center for International for Forestry Research;Report;;
Svenning;1998;PR;Svenning 1998;Svenning 1998;Svenning1998;Jens-Christian Svenning ;Jens-Christian Svenning ;Svenning, J. C.;;https://doi.org/10.1023/a:1008831600795;https://link.springer.com/article/10.1023/A:1008831600795;The effect of land-use on the local distribution of palm species in an Andean rain forest fragment in northwestern Ecuador;Springer Science and Business Media LLC;Journal Article;Biodiversity and Conservation;
Aravena;2002;CU;Aravena et al. 2002;Aravena et al. 2002;;Douglas Sheil;douglas.sheil@nmbu.no;Douglas Sheil;JUAN C. ARAVENA, MARTÍN R. CARMONA, CECILIA A. PÉREZ1 & JUAN J. ARMESTO1.2;http://dx.doi.org/10.4067/S0716-078X2002000200007;https://www.scielo.cl/scielo.php?script=sci_arttext&pid=S0716-078X2002000200007&lng=en;Changes in tree species richness, stand structure and soil properties in a successional chronosequence in northern Chiloe Island;scielo;Journal Article;Revista Chilena de Historia Natural;Plants Broadleaf NT Chile -43122 -74030 75 4 1 no 75:339–360.
Buckney and Morrison;1992;CU;Buckney and Morrison 1992;Buckney and Morrison 1992;;R. T. BUCKNEY;;R. T. BUCKNEY;D. A. Morrison;https://doi.org/10.1111/j.1442-9993.1992.tb00806.x;https://onlinelibrary.wiley.com/doi/10.1111/j.1442-9993.1992.tb00806.x;Temporal trends in plant species composition on mined sand dunes in Myall Lakes National Park;Wiley;Journal Article;Australian Journal of Ecology;Plants Transition AA Australia -32410 152470 80 3 4 yes 17:241–254.
Chapman;2006;CU;Chapman et al. 1997;Chapman et al. 1997;;Colin A. Chapman;Department of Zoology, University of Florida, Gainesville, Florida 36211, U.S.A.;Colin A. Chapman;Lauren J. Chapman;https://doi.org/10.1111/j.1744-7429.1997.tb00035.x;https://onlinelibrary.wiley.com/doi/10.1111/j.1744-7429.1997.tb00035.x;Forest Regeneration in Logged and Unlogged Forests of Kibale National Park;Wiley;Journal Article;Biotropica;Plants Broadleaf AT Uganda 0.574 30394 1500 2 2 yes 29:396–412.
Eilu and Obua;2004;CU;Eilu and Obua 2005;Eilu and Obua 2005;;Gerald Eilu;https://www.researchgate.net/profile/Gerald-Eilu;Gerald Eilu;Joseph ObuaJoseph Obua;https://www.researchgate.net/publication/228960580_Tree_condition_and_natural_regeneration_in_disturbed_sites_of_Bwindi_Impenetrable_Forest_National_Park_southwestern_Uganda;https://www.researchgate.net/publication/228960580_Tree_condition_and_natural_regeneration_in_disturbed_sites_of_Bwindi_Impenetrable_Forest_National_Park_southwestern_Uganda;Tree condition and natural regeneration in disturbed sites of Bwindi Impenetrable Forest National Park, southwestern;ResearchGate;Journal Article;Tropical Ecology;Plants Broadleaf AT Uganda -1030 29686 1750 4 2 yes 46:99–111.
Fang and Peng;1997;CU;Fang and Peng 1997;Fang and Peng 1997;;W Fang;W Fang;;S.L Peng;https://doi.org/10.1016/S0378-1127(97)00204-1;https://api.elsevier.com/content/article/PII:S0378112797002041?httpAccept=text/xml;Development of species diversity in the restoration process of establishing a tropical man-made forest ecosystem in China;Elsevier BV;Journal Article;Forest Ecology and Management;Plants Transition IM China 21464 110905 40 7 1 no 99:185–196.
Fukushima;2008;CU;Fukushima et al. 2008;Fukushima et al. 2008;;Maki Fukushima;Maki Fukushima;;Mamoru Kanzaki , Masatoshi Hara , Tatsuhiro Ohkubo , Pornchai Preechapanya , Chalathon Choocharoen ;https://doi.org/10.1016/j.foreco.2007.12.022;https://www.sciencedirect.com/science/article/abs/pii/S0378112707009632;Secondary forest succession after the cessation of swidden cultivation in the montane forest area in Northern Thailand;Elsevier BV;Journal Article;Forest Ecology and Management;Plants Broadleaf IM Thailand 18553 98515 930 21 7 yes 255:1994–2006.
Gillison;2003;CU;Gillison et al. 2003;Gillison et al. 2003;;Andrew N. Gillison;Andrew N. Gillison;;David T. Jones, F. Susilo, D. Bignell;https://doi.org/10.1078/1439-6092-00072;https://www.semanticscholar.org/paper/Vegetation-indicates-diversity-of-soil-a-case-study-Gillison-Jones/c3dbea1f178087de26db881b37a18e3cde510291;Vegetation indicates diversity of soil macroinvertebrates: a case study with termites along a land-use intensification gradient in lowland Sumatra;Semantic Scholar;Journal Article;Organisms Diversity and Evolution;Termites Broadleaf IM Indonesia -1079 102099 60 1 1 no 3:111–126.
Grau;1997;CU;Grau et al. 1997;Grau et al. 1997;;H.R. Grau;H.R. Grau;;M.F. Arturi , A.D. Brown , P.G. Aceñolaza;https://doi.org/10.1016/s0378-1127(97)00010-8;https://www.sciencedirect.com/science/article/abs/pii/S0378112797000108;Floristic and structural patterns along a chronosequence of secondary forest succession in Argentinean subtropical montane forests;Elsevier BV;Journal Article;Forest Ecology and Management;Plants Broadleaf NT Argentina -26800 -65383 1000 4 2 yes 95:161–171.
Ishida;2005;CU;Ishida et al. 2005;Ishida et al. 2005;IshidaEtAl2005;H.R. Grau;liey@untlie.edu.ar;H.R. Grau;M.F. Arturi , A.D. Brown , P.G. Aceñolaza;https://doi.org/10.1016/S0378-1127(97)00010-8;https://www.sciencedirect.com/science/article/abs/pii/S0378112797000108;Comparison of species composition and richness between primary and secondary lucidophyllous forests in two altitudinal zones of Tsushima Island;sciencedirect;Journal Article;Forest Ecology and Management;Plants Broadleaf PA Japan 34417 129333 350 2 2 no
Kennard;2002;CU;Kennard 2002;Kennard 2002;;DEBORAH K. KENNARD;DEBORAH K. KENNARD;;0;https://doi.org/10.1017/s0266467402002031;https://www.cambridge.org/core/journals/journal-of-tropical-ecology/article/abs/secondary-forest-succession-in-a-tropical-dry-forest-patterns-of-development-across-a-50year-chronosequence-in-lowland-bolivia/DB9431DC2D3B4DDF129336E892E8544D;Secondary Forest Succession in a Tropical Dry Forest: Patterns of Development Across a 50-Year Chronosequence in Lowland Bolivia;Cambridge University Press (CUP);Journal Article;Journal of Tropical Ecology;Plants Transition NT Bolivia -16750 -61750 500 12 1 no 18:53–66.
Li;2011;CU;Li et al. 2011;Li et al. 2011;;Su Li ;"Key Laboratory of Tropical Forest Ecology, Xishuangbanna Tropical Botanical Garden, Chinese Academy of Sciences, Kunming 650223, China
Graduate School of the Chinese Academy of Sciences, Beijing 100049, China";Su Li ;Wenyao Liu , Lisong Wang , Wenzhang Ma, Liang Song;https://doi.org/10.1016/j.foreco.2011.01.037;https://www.sciencedirect.com/science/article/abs/pii/S0378112711000697;Biomass, diversity and composition of epiphytic macrolichens in primary and secondary forests in the subtropical Ailao Mountains, SW China. Forest Ecology and Management.;sciencedirect;Journal Article;Acta Zool Mexicana.(Nueva Serie);Epiphytes Broadleaf PA China 24063 101278 2300 3 1 no 15:1–72.
Liebsch;2007;CU;Liebsch et al. 2008, Liebsch et al. 2007;Liebsch et al. 2008, Liebsch et al. 2007;;Dieter Liebsch;Universidade Federal do Paraná, Setor de Ciências Biológicas , Departamento de Botânica, Curitiba, Paraná, Brazil;Dieter Liebsch;Renato Goldenberg, Márcia Cristina Mendes Marques;https://doi.org/10.1590/S0102-33062007000400023;https://www.scielo.br/j/abb/a/tP4v8Jn5vzxpNbkrkQfFY8f/;Florística e estrutura de comunidades vegetais em uma cronoseqüência de Floresta Atlântica no Estado do Paraná;scielo;Journal Article;Acta Bot. Bras;Acta Botanica Brasilica 21:983–992.
Parrotta and Knowles;2011;CU;Parrotta and Knowles 2001;Parrotta and Knowles 2001;;John A Parrotta ;John A Parrotta ;;Oliver H Knowles;https://doi.org/10.1016/s0925-8574(00)00141-5;https://www.sciencedirect.com/science/article/abs/pii/S0925857400001415;Restoring tropical forests on lands mined for bauxite: Examples from the Brazilian Amazon;Elsevier BV;Journal Article;Ecological Engineering;Plants Broadleaf NT Brazil -1667 -56450 180 5 1 no 17:219–239.
Pascarella;2000;CU;Pascarella et al. 2000;Pascarella et al. 2000;;John B. Pascarella;"John Pascarella
ProfessorSam Houston State University
United States";John B. Pascarella;T. Mitchell Aide, Mayra I. Serrano & Jess K. Zimmerman;https://doi.org/10.1007/s100210000021;https://link.springer.com/article/10.1007/s100210000021;Land-Use History and Forest Regeneration in the Cayey Mountains;ResearchGate;Journal Article;Ecosystems;Plants Broadleaf NT Puerto Rico 18000 -66100 500 33 4 no 3:217–228.
Powers;2009;CU;Powers et al. 2009;Powers et al. 2009;;Jennifer S. Powers;Jennifer S. Powers;; Justin M. Becknell , Jennifer Irving , Daniel Pèrez-Aviles;https://doi.org/10.1016/j.foreco.2008.10.036;https://www.sciencedirect.com/science/article/abs/pii/S0378112708008165;Diversity and structure of regenerating tropical dry forests in Costa Rica: Geographic patterns and environmental drivers;Elsevier BV;Journal Article;Forest Ecology and Management;Plants Transition NT Costa Rica 10840 85620 550 22 3 yes 258:959–970.
Purata;1986;CU;Purata 1986;Purata 1986;;Silvia E. Purata;Silvia E. Purata;;0;https://doi.org/10.1017/s0266467400000882;https://www.cambridge.org/core/journals/journal-of-tropical-ecology/article/abs/floristic-and-structural-changes-during-oldfield-succession-in-the-mexican-tropics-in-relation-to-site-history-and-species-availability/8A362F33925030F361E30B22B9A40F13;Floristic and structural changes during old-field succession in the Mexican tropics in relation to site history and species availability;Cambridge University Press (CUP);Journal Article;Journal of Tropical Ecology;Plants Broadleaf NT Mexico 18582 -95105 450 25 1 no 2:257–276.
Selmants and Knight;2003;CU;Selmants and Knight 2003;Selmants and Knight 2003;;Paul C Selmants;pcs4@dana.ucc.nau.edu;Paul C Selmants;Dennis H Knight;https://doi.org/10.1016/S0378-1127(03)00224-X;https://www.sciencedirect.com/science/article/abs/pii/S037811270300224X;Understory plant species composition 30-50 years after clearcutting in southeastern Wyoming coniferous forests;sciencedirect;Journal Article;Forest Ecology and Management;Plants Conifer NA United States 41000 -106000 2900 30 24 no 185:275–289.
Stark;2006;CU;Stark et al. 2006;Stark et al. 2006;; Kaeli E. Stark; Kaeli E. Stark;;André Arsenault, and Gary E. Bradfield;https://doi.org/10.1139/b06-112;https://cdnsciencepub.com/doi/10.1139/b06-112;Soil seed banks and plant community assembly following disturbance by fire and logging in interior Douglas-fir forests of south-central British Columbia;Canadian Science Publishing;Journal Article;Canadian Journal of Botany;Plants Conifer NA Canada 50700 -120300 900 21 10 yes 84:1548–1560.
Aubin;2009;RU;Aubin 2009;Aubin 2009;;Isabelle Aubin;iaubin@sympatico.ca; M. H. Ouellette P. Legendre C. Messier A. Bouchard . J. Veg. ;Marie-Hélène Ouellette, Pierre Legendre, Christian Messier and André Bouchard;https://doi.org/10.1111/j.1654-1103.2009.05513.x;https://onlinelibrary.wiley.com/doi/10.1111/j.1654-1103.2009.05513.x;Comparison of two plantfunctional approaches to evaluate natural restoration along an old-field - deciduous forestchronosequence;Wiley;Journal Article;;Sci. 20 185–198 
Bruelheide;2011;RU;Bruelheide 2011;Bruelheide 2011;;H. Bruelheide;helge.bruelheide@botanik.uni-halle.de; M. Böhnke S. Both T. Fang T. Assmann M. Baruffol J. Bauhus F. Buscot X. Y. Chen B. Y. Ding W. Durka A. Erfmeier M. Fischer C. Geißler D. Guo L. D. Guo W. Härdtle J. S. He A. Hector W. Kröber P. Kühn A. C. Lang K. Nadr;, M. Böhnke, S. Both, T. Fang, T. Assmann, M. Baruffol, J. Bauhus, F. Buscot, X. Y. Chen, B. Y. Ding, W. Durka, A. Erfmeier, M. Fischer, C. Geißler, D. Guo, L. D. Guo, W. Härdtle, J. S. He, A. Hector, W. Kröber, P. Kühn, A. C. Lang, K. Nadrowski, K. Pei, M. Scherer-Lorenzen, X. Shi, T. Scholten, A. Schuldt, S. Trogisch, G. Von Oheimb, E. Welk, C. Wirth, Y. T. Wu, X. Yang, X. Zeng, S. Zhang, H. Zhou, K. Ma, B. Schmid, ;https://doi.org/10.1890/09-2172.1;https://esajournals.onlinelibrary.wiley.com/doi/abs/10.1890/09-2172.1;Community assembly during secondary forest succession in a Chinese subtropical forest. ;ESA;Journal Article;;Ecol. Monogr. 81, 25–41 (2011).
Chan;2016;RU;Chan 2016;Chan 2016;;Nyein Chan;nchan08@gmail.com; S. Takeda R. Suzuki S. Yamamoto;Shinya Takeda, Reiji Suzuki & Sota Yamamoto ;https://doi.org/10.1007/s11056-016-9531-y;https://link.springer.com/article/10.1007/s11056-016-9531-y;Assessment of biomass recovery and soil carbon storage of fallow forests after swidden cultivation in the Bago Mountains Myanmar;Springer Science and Business Media LLC;Journal Article;New For;47 565–585 
Dalling;1998;RU;Dalling 1998;Dalling 1998;;J.W. Dalling;Graduate School of Asian and African Area Studies, Kyoto University, Kyoto, Japan; J. S. Denslow a. J. Veg;J.S. Denslow;https://doi.org/10.2307/3237285;https://onlinelibrary.wiley.com/doi/10.2307/3237285;Soil seed bank composition along a forest chronosequence in seasonally moist tropical forest ;Wiley;Journal Article;Sci;9 669–678 
Davidson;2007;RU;Davidson 2007;Davidson 2007;;Eric A. Davidson;edavidson@whrc.org; C. J. R. De Carvalho A. M. Figueira F. Y. Ishida J. P. H. B. Ometto G. B. Nardoto R. T. Sabá S. N. Hayashi E. C. Leal I. C. G. Vieira L. A. Martinelli ;Cláudio J. Reis de Carvalho, Adelaine Michela Figueira, Françoise Yoko Ishida, Jean Pierre H. B. Ometto, Gabriela B. Nardoto, Renata Tuma Sabá, Sanae N. Hayashi, Eliane C. Leal, Ima Célia G. Vieira & Luiz A. Martinelli ;https://doi.org/10.1038/nature05900;https://www.nature.com/articles/nature05900;Recuperation of nitrogen cycling in Amazonian forests following agricultural;nature;Journal Article;;
DeWalt;2003;RU;DeWalt 2003;DeWalt 2003;;Saara J. DeWalt ;; S. K. Maliakal J. S. Denslow;Satya K. Maliakal , Julie S. Denslow;https://doi.org/10.1016/S0378-1127(03)00029-X;https://www.sciencedirect.com/science/article/abs/pii/S037811270300029X; Changes in vegetation structure and composition along a tropical forest chronosequence: Implications for wildlife;sciencedirect;Journal Article;For. Ecol. Manage;182 139–151 
Dent;2013;RU;Dent 2013;Dent 2013;;Daisy H. Dent;Daisy H. Dent; S. J. Dewalt J. S. Denslow . J. Veg;Saara J. DeWalt, Julie S. Denslow;https://doi.org/10.1111/j.1654-1103.2012.01482.x;https://api.wiley.com/onlinelibrary/tdm/v1/articles/10.1111%2Fj.1654-1103.2012.01482.x;Secondary forests of central Panama increase in similarity to old-growth forest over time in shade tolerance but not species composition;Wiley;Journal Article;Sci;24 530–542 
Dungan;2001;RU;Dungan 2001;Dungan 2001;;R. J. Dungan;R. J. Dungan; D. A. Norton R. P. Duncan . ;D.A. NortonConservation Research Group, School of Forestry, University of Canterbury, Private Bag 4800, Christchurch, New Zealand &R. P. Duncan;https://doi.org/10.1080/0028825X.2001.9512719;https://www.tandfonline.com/doi/abs/10.1080/0028825X.2001.9512719;Seed rain in successional vegetation Port Hills Ecological District New Zealand;Taylor rancis On line;Journal Article;New Zeal. J. Bot. ;39 115–124 
Goebel;1996;RU;Goebel 1996;Goebel 1996;;P.Charles Goebel;Ecological Research Center, Route 2, Box 2324, Newton, GA 31770, USA.; D. M. Hix J. W. Jones;David M. Hix;https://doi.org/10.1016/0378-1127(96)03772-3;https://api.elsevier.com/content/article/PII:0378112796037723?httpAccept=text/xml;Development of mixed-oak forests in southeastern Ohio: A comparison of second-growth and old-growth forests;Elsevier BV;Journal Article;For. Ecol. Manage;84 1–21 
Leiva;2009;RU;Leiva 2009;Leiva 2009;;Jorge A Leiva;"Ph.D.Professor (Assistant) at University of Costa Rica
Tres Ríos, Cartago, Costa Rica"; O. J. Rocha R. Mata M. V Gutiérrez-Soto;Oscar J Rocha, Rafael Mata, Marco V Gutiérrez-Soto;https://www.researchgate.net/publication/40021958_Chronology_of_tropical_dry_forest_regeneration_in_Santa_Rosa_Guanacaste_Costa_Rica_II_Vegetation_in_relation_to_the_soil;https://www.researchgate.net/publication/40021958_Chronology_of_tropical_dry_forest_regeneration_in_Santa_Rosa_Guanacaste_Costa_Rica_II_Vegetation_in_relation_to_the_soil;Chronology of tropical dry forest regeneration in Santa Rosa Guanacaste Costa Rica II  Vegetation in relation to the soil;ResearchGate;Journal Article; . Rev. Biol. Trop. ;57 817–36 
Lu;2014;RU;Lu 2014;Lu 2014;;Xinghui Lu;Key Laboratory of Forest Ecology and Environment of State Forestry Administration, Institute of Forest Ecology, Environment and Protection, Chinese Academy of Forestry, Beijing, 100091 China; R. Zang Y. Ding S. G. Letcher W. Long Y. Huang;Runguo Zang, Yi Ding, Susan G. Letcher, Wenxing Long, Yunfeng Huang;https://doi.org/10.1111/btp.12125;https://onlinelibrary.wiley.com/doi/abs/10.1111/btp.12125;Variations and trade-offs in functional traits of tree seedlings during secondary succession in a tropical lowland rain forest;Wiley;Journal Article;Biotropica. ;46 404–414 
Marin-Spiotta;2007;RU;Marin-Spiotta 2007;Marin-Spiotta 2007;;E. Marín-Spiotta;E. Marín-Spiotta; R. Ostertag W. L. Silver ;W. L. Silver, R. Ostertag;https://doi.org/10.1890/06-1268;https://esajournals.onlinelibrary.wiley.com/doi/10.1890/06-1268;Long-term patterns in tropical reforestation: Plant community composition and aboveground biomass accumulation;Wiley;Journal Article;Ecol. Appl;17 828–839 
Moola and Vasseur;2004;RU;Moola and Vasseur 2004;Moola and Vasseur 2004;;;F.M. Moola; L. Vasseur;L. Vasseur ;https://doi.org/10.1023/B:VEGE.0000026326.09137.06;https://link.springer.com/article/10.1023/B:VEGE.0000026326.09137.06;Recovery of late-seral vascular plants in a chronosequence of post-clearcut forest stands in coastal Nova Scotia Canada;Springer Science and Business Media LLC;Journal Article;Plant Ecol;172 183–197 
Muniz-Castro;2011;RU;Muniz-Castro 2011;Muniz-Castro 2011;;;Miguel Angel Muñiz-Castro; G. Williams-Linera J. M. R. Benayas;Guadalupe Williams-Linera  and José María Rey Benayas;https://doi.org/10.1017/S0266467406003221;https://www.cambridge.org/core/journals/journal-of-tropical-ecology/article/abs/distance-effect-from-cloud-forest-fragments-on-plant-community-structure-in-abandoned-pastures-in-veracruz-mexico/FDA8697CE94AF6A4EEB17E570947F885; Distance effect from cloud forest fragments on plant community structure in abandoned pastures in Veracruz Mexico;Cambridge University Press (CUP);Journal Article; J. Trop. Ecol;22 431–440 
